{
  "$schema": "https://json-schema.org/draft/2020-12/schema",
  "$id": "https://boundedagentharness.com/contracts/project-context-sources.v1.schema.json",
  "title": "Bounded Agent Harness candidate project-context sources v1",
  "type": "array",
  "maxItems": 1000,
  "items": {
    "type": "object",
    "additionalProperties": false,
    "required": ["id", "projectId", "repositoryId", "path", "locator"],
    "properties": {
      "id": { "$ref": "project-scope-manifest.v1.schema.json#/$defs/id" },
      "projectId": { "$ref": "project-scope-manifest.v1.schema.json#/$defs/id" },
      "repositoryId": { "$ref": "project-scope-manifest.v1.schema.json#/$defs/id" },
      "path": { "$ref": "project-scope-manifest.v1.schema.json#/$defs/path" },
      "locator": { "$ref": "project-scope-manifest.v1.schema.json#/$defs/locator" },
      "dependencyId": { "$ref": "project-scope-manifest.v1.schema.json#/$defs/id" }
    }
  }
}
